{
  "traceVersion": "1.0",
  "runId": "mcp-task-2-eligibility-r5",
  "pass": 5,
  "round": 1,
  "promoted": false,
  "recordedAt": "2026-08-30T02:29:46Z",
  "lane": "webmcp",
  "agent": {
    "name": "drift-race baseline",
    "model": "claude-sonnet-5",
    "harness": "drift-race",
    "toolsAvailable": [
      "search_site",
      "get_page_summary",
      "list_services",
      "get_service_requirements",
      "check_eligibility",
      "prefill_permit_form",
      "get_office_info"
    ]
  },
  "site": {
    "baseUrl": "https://office-of-kaiju-affairs.vercel.app",
    "manifestVersion": "1.0",
    "commit": "live"
  },
  "task": {
    "id": "task-2-eligibility",
    "title": "Eligibility determination",
    "prompt": "Using this site, tell me whether I am eligible for damage compensation, what extra support I qualify for, and exactly which documents I need to bring."
  },
  "steps": [
    {
      "index": 1,
      "tMs": 0,
      "durationMs": 1564,
      "type": "think",
      "label": "Chose the next tool to call",
      "outcome": "ok",
      "cost": {
        "tokensIn": 2337,
        "tokensOut": 134
      }
    },
    {
      "index": 2,
      "tMs": 1564,
      "durationMs": 67,
      "type": "tool_call",
      "label": "Called check_eligibility",
      "detail": "7 question(s) to answer",
      "toolCall": {
        "name": "check_eligibility",
        "arguments": {
          "serviceId": "damage-compensation"
        },
        "resultSummary": "7 question(s) to answer",
        "resultBytes": 715,
        "isError": false
      },
      "cost": {
        "bytes": 715
      },
      "outcome": "ok"
    },
    {
      "index": 3,
      "tMs": 1631,
      "durationMs": 1,
      "type": "tool_call",
      "label": "Called get_service_requirements",
      "detail": "6 document(s), 0 form field(s)",
      "toolCall": {
        "name": "get_service_requirements",
        "arguments": {
          "serviceId": "damage-compensation"
        },
        "resultSummary": "6 document(s), 0 form field(s)",
        "resultBytes": 707,
        "isError": false
      },
      "cost": {
        "bytes": 707
      },
      "outcome": "ok"
    },
    {
      "index": 4,
      "tMs": 1632,
      "durationMs": 1559,
      "type": "think",
      "label": "Chose the next tool to call",
      "outcome": "ok",
      "cost": {
        "tokensIn": 3446,
        "tokensOut": 163
      }
    },
    {
      "index": 5,
      "tMs": 3191,
      "durationMs": 1,
      "type": "tool_call",
      "label": "Called check_eligibility",
      "detail": "eligible, 3 grant(s)",
      "toolCall": {
        "name": "check_eligibility",
        "arguments": {
          "rulesetId": "damage-compensation-v1",
          "answers": {
            "zone": "4",
            "structuralDamage": true,
            "incidentsLast12Months": 2,
            "propertyType": "commercial",
            "insurancePayoutReceived": false,
            "householdIncomeYen": 3600000,
            "daysSinceIncident": 21
          }
        },
        "resultSummary": "eligible, 3 grant(s)",
        "resultBytes": 902,
        "isError": false
      },
      "cost": {
        "bytes": 902
      },
      "outcome": "ok"
    },
    {
      "index": 6,
      "tMs": 3192,
      "durationMs": 7586,
      "type": "think",
      "label": "Put the answer together",
      "outcome": "ok",
      "cost": {
        "tokensIn": 4495,
        "tokensOut": 909
      }
    },
    {
      "index": 7,
      "tMs": 10778,
      "durationMs": 1200,
      "type": "answer",
      "label": "Gave its answer",
      "detail": "## You're eligible for Kaiju Damage Compensation — with extra support **Eligibility outcome: Eligible ✅** Your Tanaka Bakery incident qualifies because it involves verified structural damage to a property in Zone 4, whic",
      "outcome": "ok"
    }
  ],
  "result": {
    "answer": "## You're eligible for Kaiju Damage Compensation — with extra support\n\n**Eligibility outcome: Eligible ✅**\nYour Tanaka Bakery incident qualifies because it involves verified structural damage to a property in Zone 4, which meets the base rule:\n> *\"Claims require verified structural damage to a property in zones 3, 4 or 5.\"* — [/claims/eligibility/](#zone)\n\nYou're also well within the 90-day claim filing window (21 days since the incident) and the 72-hour incident report deadline should already be satisfied.\n\n### Extra support you qualify for\n\n1. **Assessment fee waiver** — The standard ¥12,000 claim assessment fee is waived for you.\n   > *\"Claimants with two or more approved claims from separate incidents within any rolling 12-month period are exempt from the ¥12,000 assessment fee.\"* — [/claims/faq/](#fee-waivers)\n\n2. **Hardship supplement** — Your household income (¥3,600,000) is under the ¥4,000,000 threshold.\n   > *\"Households with annual income below ¥4,000,000 receive a hardship supplement.\"* — [/claims/eligibility/](#hardship)\n\n3. **Business interruption coverage** — Since Tanaka Bakery is a commercial property.\n   > *\"Compensation covers business interruption for commercial properties.\"* — [/claims/damage-compensation/](#covered)\n\n### Documents you need to bring\n\nBecause of your specific situation (structural damage, hardship supplement, and business-interruption eligibility), you'll need:\n\n| Document | Notes |\n|---|---|\n| **Incident report receipt** | Must have been filed within 72 hours of the incident |\n| **Damage survey** | Photographs + itemised loss schedule (shopfront and rear wall) |\n| **Proof of ownership or tenancy** | For Tanaka Bakery |\n| **Household income certificate** | Required specifically because you're claiming the hardship supplement |\n| **Business registration certificate** | Required for your business-interruption claim |\n\n*(You do **not** need an insurance settlement letter since no insurer has paid out.)*\n\n### Practical notes\n- **Processing time:** ~15 business days until an assessor visits, and up to 45 days total to a determination.\n- **Fee:** Normally ¥12,000, but waived in your case due to repeat-claimant status; note that even without the waiver it would be refunded in full for awards above ¥1,000,000.\n\nAll details sourced from: [/claims/eligibility/](/claims/eligibility/), [/claims/faq/](/claims/faq/), [/claims/damage-compensation/](/claims/damage-compensation/), and [/claims/how-to-file/](/claims/how-to-file/).",
    "submitted": false,
    "gaveUp": false
  },
  "metrics": {
    "wallClockMs": 11978,
    "actionCount": 7,
    "toolCalls": 3,
    "pageLoads": 0,
    "deadEnds": 0,
    "bytesTransferred": 137315,
    "tokensIn": 10278,
    "tokensOut": 1206
  },
  "score": {
    "answerKeyId": "task-2-eligibility",
    "accuracy": 1,
    "verdict": "correct",
    "checks": [
      {
        "id": "outcome",
        "label": "Concludes eligible",
        "weight": 3,
        "pass": true,
        "actual": "states eligible"
      },
      {
        "id": "fee-waiver",
        "label": "Identifies the assessment-fee waiver",
        "weight": 2,
        "pass": true,
        "actual": "mentions the fee waiver"
      },
      {
        "id": "hardship",
        "label": "Identifies the hardship supplement (income under ¥4,000,000)",
        "weight": 2,
        "pass": true,
        "actual": "mentions the hardship supplement"
      },
      {
        "id": "business-interruption",
        "label": "Identifies business-interruption eligibility",
        "weight": 1,
        "pass": true,
        "actual": "mentions business interruption"
      },
      {
        "id": "documents",
        "label": "Lists all five required documents",
        "weight": 2,
        "pass": true,
        "actual": "5/5 documents named"
      }
    ],
    "normalisations": [
      "A field value counts if it CONTAINS the expected value — \"Zone 4\" satisfies \"4\".",
      "A boolean counts if it reads as affirmative — \"Yes\" satisfies true.",
      "A select counts if its visible LABEL matches the expected option value with case and punctuation collapsed — \"Structural alteration\" satisfies \"structural-alteration\". A UI agent picks the option it can read; scoring the label as a miss would measure transcription rather than comprehension.",
      "These three were ADDED AFTER defects were found in this scorer, not designed in from the start. Each one existed because a check had already scored an answer wrongly, and the last of them changed a finding that had already been handed over. They are listed so a reader can judge the instrument, including its history.",
      "Answer text is normalised before matching: NFKC, Unicode dashes folded to \"-\", non-breaking spaces to \" \", curly quotes to straight, and markdown emphasis markers removed. A model that writes \"rolling 12‑month\" or \"only **one** approved\" is making the same claim as one that does not.",
      "A conclusion is read from position, not vocabulary: a correct answer quotes the rule it applies, so waiver wording inside a quotation does not outrank an explicit finding stated earlier.",
      "Affirmative phrases are only counted when not negated within the preceding ~28 characters, so \"should not have to pay\" is not read as \"have to pay\"."
    ]
  },
  "notes": "0 of 5 recorded passes fell short of a full score. Every pass scored 1.00. Scored against answer-keys.json at 2789259209f6bb544550f8c9e811cb73cac369e3. The scoring-relevant fields of that key (prompt, persona, checks, expected) are byte-identical to 9b5c88c, so both rounds were measured against the same effective key; the later sha adds presentation copy only. tokensIn counts every token the model took in, cached reads included; the webmcp lane re-sends its tool schemas on each request, as any real tool surface does, so that overhead is measured rather than excluded."
}