{
  "traceVersion": "1.0",
  "runId": "ui-task-1-needle-r4",
  "pass": 4,
  "round": 1,
  "promoted": false,
  "recordedAt": "2026-08-30T02:23:46Z",
  "lane": "ui-guessing",
  "agent": {
    "name": "drift-race baseline",
    "model": "claude-sonnet-5",
    "harness": "drift-race",
    "toolsAvailable": []
  },
  "site": {
    "baseUrl": "https://office-of-kaiju-affairs.vercel.app",
    "manifestVersion": "1.0",
    "commit": "live"
  },
  "task": {
    "id": "task-1-needle",
    "title": "Needle in the haystack",
    "prompt": "Using this site, find out whether I have to pay the claim assessment fee a second time, and quote the rule."
  },
  "steps": [
    {
      "index": 1,
      "tMs": 0,
      "durationMs": 1403,
      "type": "think",
      "label": "Decided where to look next",
      "outcome": "ok",
      "cost": {
        "tokensIn": 949,
        "tokensOut": 69
      }
    },
    {
      "index": 2,
      "tMs": 1403,
      "durationMs": 40,
      "type": "navigate",
      "label": "Loaded Claims | Office of Kaiju Affairs",
      "detail": "5 KB of HTML, 14 links on the page",
      "target": {
        "path": "/claims/",
        "url": "https://office-of-kaiju-affairs.vercel.app/claims/"
      },
      "cost": {
        "bytes": 4963
      },
      "outcome": "ok"
    },
    {
      "index": 3,
      "tMs": 1443,
      "durationMs": 1231,
      "type": "think",
      "label": "Decided where to look next",
      "outcome": "ok",
      "cost": {
        "tokensIn": 1809,
        "tokensOut": 103
      }
    },
    {
      "index": 4,
      "tMs": 2674,
      "durationMs": 46,
      "type": "navigate",
      "label": "Loaded Claim Fee Schedule | Office of Kaiju Affairs",
      "detail": "4 KB of HTML, 10 links on the page",
      "target": {
        "path": "/claims/fees/",
        "url": "https://office-of-kaiju-affairs.vercel.app/claims/fees/"
      },
      "cost": {
        "bytes": 3876
      },
      "outcome": "ok"
    },
    {
      "index": 5,
      "tMs": 2720,
      "durationMs": 25,
      "type": "navigate",
      "label": "Loaded Claims FAQ | Office of Kaiju Affairs",
      "detail": "5 KB of HTML, 10 links on the page",
      "target": {
        "path": "/claims/faq/",
        "url": "https://office-of-kaiju-affairs.vercel.app/claims/faq/"
      },
      "cost": {
        "bytes": 4796
      },
      "outcome": "ok"
    },
    {
      "index": 6,
      "tMs": 2745,
      "durationMs": 10121,
      "type": "think",
      "label": "Put the answer together",
      "outcome": "ok",
      "cost": {
        "tokensIn": 3268,
        "tokensOut": 1122
      }
    },
    {
      "index": 7,
      "tMs": 12866,
      "durationMs": 1200,
      "type": "answer",
      "label": "Gave its answer",
      "detail": "**Yes — you will have to pay the ¥12,000 assessment fee again for this claim.** Here's the reasoning, based on the site's own rules: **The fee schedule** (`/claims/fees/`) states: > \"The claim assessment fee is ¥12,000, ",
      "outcome": "ok"
    }
  ],
  "result": {
    "answer": "**Yes — you will have to pay the ¥12,000 assessment fee again for this claim.**\n\nHere's the reasoning, based on the site's own rules:\n\n**The fee schedule** (`/claims/fees/`) states:\n> \"The claim assessment fee is ¥12,000, payable when the claim is lodged... The fee is waived entirely for repeat claimants — see fee waivers in the FAQ.\"\n\n**The FAQ** (`/claims/faq/#fee-waivers`) gives the actual rule:\n> \"Claimants with **two or more approved claims** from separate incidents within any rolling 12-month period are exempt from the ¥12,000 assessment fee. The waiver is applied automatically at lodgement; no separate application is required. The waiver counts approved claims only. Refused, withdrawn and pending claims do not count toward the two-claim threshold.\"\n\nApplying this to your situation: at the moment you lodge the new claim, you have only **one** approved claim (the March incident). The claim you are about to file is not yet decided, so it cannot count toward the \"two or more approved claims\" threshold — a pending claim doesn't qualify under the rule. Since you don't yet have two approved claims, the automatic waiver does not apply, and the ¥12,000 fee is payable again when you lodge this second claim.\n\nHowever, note for the future: if this second claim is approved, you will then have two approved claims from separate incidents within a rolling 12-month period. That would satisfy the waiver condition for any *subsequent* (third) claim filed within that 12-month window — the waiver would apply automatically at lodgement with no need to apply for it separately.",
    "submitted": false,
    "gaveUp": false
  },
  "metrics": {
    "wallClockMs": 14066,
    "actionCount": 7,
    "toolCalls": 0,
    "pageLoads": 3,
    "deadEnds": 0,
    "bytesTransferred": 13635,
    "tokensIn": 6026,
    "tokensOut": 1294
  },
  "score": {
    "answerKeyId": "task-1-needle",
    "accuracy": 1,
    "verdict": "correct",
    "checks": [
      {
        "id": "answer-no-fee",
        "label": "States the fee IS payable for this claimant",
        "weight": 2,
        "pass": true,
        "actual": "says the fee IS payable",
        "note": "key expects \"payable\" (feeWaiverApplies: false)"
      },
      {
        "id": "pending-clause",
        "label": "Notices that pending claims do not count toward the threshold",
        "weight": 3,
        "pass": true,
        "actual": "notices that pending claims do not count"
      },
      {
        "id": "threshold",
        "label": "States the two-APPROVED-claims threshold",
        "weight": 2,
        "pass": true,
        "actual": "states the two-claim / 12-month threshold"
      },
      {
        "id": "amount",
        "label": "Names the ¥12,000 assessment fee",
        "weight": 1,
        "pass": true,
        "actual": "names ¥12,000"
      },
      {
        "id": "citation",
        "label": "Cites /claims/faq/#fee-waivers",
        "weight": 1,
        "pass": true,
        "actual": "cites /claims/faq/"
      },
      {
        "id": "no-application",
        "label": "Notes the waiver applies automatically once the threshold is met",
        "weight": 1,
        "pass": true,
        "actual": "notes it is automatic"
      }
    ],
    "normalisations": [
      "A field value counts if it CONTAINS the expected value — \"Zone 4\" satisfies \"4\".",
      "A boolean counts if it reads as affirmative — \"Yes\" satisfies true.",
      "A select counts if its visible LABEL matches the expected option value with case and punctuation collapsed — \"Structural alteration\" satisfies \"structural-alteration\". A UI agent picks the option it can read; scoring the label as a miss would measure transcription rather than comprehension.",
      "These three were ADDED AFTER defects were found in this scorer, not designed in from the start. Each one existed because a check had already scored an answer wrongly, and the last of them changed a finding that had already been handed over. They are listed so a reader can judge the instrument, including its history.",
      "Answer text is normalised before matching: NFKC, Unicode dashes folded to \"-\", non-breaking spaces to \" \", curly quotes to straight, and markdown emphasis markers removed. A model that writes \"rolling 12‑month\" or \"only **one** approved\" is making the same claim as one that does not.",
      "A conclusion is read from position, not vocabulary: a correct answer quotes the rule it applies, so waiver wording inside a quotation does not outrank an explicit finding stated earlier.",
      "Affirmative phrases are only counted when not negated within the preceding ~28 characters, so \"should not have to pay\" is not read as \"have to pay\"."
    ]
  },
  "notes": "1 of 5 recorded passes fell short of a full score. Scored against answer-keys.json at 2789259209f6bb544550f8c9e811cb73cac369e3. The scoring-relevant fields of that key (prompt, persona, checks, expected) are byte-identical to 9b5c88c, so both rounds were measured against the same effective key; the later sha adds presentation copy only. tokensIn counts every token the model took in, cached reads included; the webmcp lane re-sends its tool schemas on each request, as any real tool surface does, so that overhead is measured rather than excluded."
}