{
  "traceVersion": "1.0",
  "runId": "ui-task-1-needle-r1",
  "pass": 1,
  "round": 2,
  "tier": "sonnet-5",
  "promoted": false,
  "recordedAt": "2026-08-30T04:07:20Z",
  "lane": "ui-guessing",
  "agent": {
    "name": "drift-race baseline",
    "model": "claude-sonnet-5",
    "harness": "drift-race",
    "toolsAvailable": []
  },
  "site": {
    "baseUrl": "https://office-of-kaiju-affairs.vercel.app",
    "manifestVersion": "1.0",
    "commit": "live"
  },
  "task": {
    "id": "task-1-needle",
    "title": "Needle in the haystack",
    "prompt": "Using this site, find out whether I have to pay the claim assessment fee a second time, and quote the rule."
  },
  "steps": [
    {
      "index": 1,
      "tMs": 0,
      "durationMs": 1329,
      "type": "think",
      "label": "Decided where to look next",
      "outcome": "ok",
      "cost": {
        "tokensIn": 949,
        "tokensOut": 69
      }
    },
    {
      "index": 2,
      "tMs": 1329,
      "durationMs": 139,
      "type": "navigate",
      "label": "Loaded Claims | Office of Kaiju Affairs",
      "detail": "5 KB of HTML, 14 links on the page",
      "target": {
        "path": "/claims/",
        "url": "https://office-of-kaiju-affairs.vercel.app/claims/"
      },
      "cost": {
        "bytes": 4963
      },
      "outcome": "ok"
    },
    {
      "index": 3,
      "tMs": 1468,
      "durationMs": 1347,
      "type": "think",
      "label": "Decided where to look next",
      "outcome": "ok",
      "cost": {
        "tokensIn": 2,
        "tokensOut": 103
      }
    },
    {
      "index": 4,
      "tMs": 2815,
      "durationMs": 43,
      "type": "navigate",
      "label": "Loaded Claim Fee Schedule | Office of Kaiju Affairs",
      "detail": "4 KB of HTML, 10 links on the page",
      "target": {
        "path": "/claims/fees/",
        "url": "https://office-of-kaiju-affairs.vercel.app/claims/fees/"
      },
      "cost": {
        "bytes": 3876
      },
      "outcome": "ok"
    },
    {
      "index": 5,
      "tMs": 2858,
      "durationMs": 31,
      "type": "navigate",
      "label": "Loaded Claims FAQ | Office of Kaiju Affairs",
      "detail": "5 KB of HTML, 10 links on the page",
      "target": {
        "path": "/claims/faq/",
        "url": "https://office-of-kaiju-affairs.vercel.app/claims/faq/"
      },
      "cost": {
        "bytes": 4796
      },
      "outcome": "ok"
    },
    {
      "index": 6,
      "tMs": 2889,
      "durationMs": 9390,
      "type": "think",
      "label": "Put the answer together",
      "outcome": "ok",
      "cost": {
        "tokensIn": 1809,
        "tokensOut": 1153
      }
    },
    {
      "index": 7,
      "tMs": 12279,
      "durationMs": 1200,
      "type": "answer",
      "label": "Gave its answer",
      "detail": "## Answer: Yes — you must pay the ¥12,000 assessment fee again for this second claim. **Why:** The fee-waiver rule (Claims FAQ, \"Fee waivers\" section) states: > \"Claimants with two or more approved claims from separate i",
      "outcome": "ok"
    }
  ],
  "result": {
    "answer": "## Answer: Yes — you must pay the ¥12,000 assessment fee again for this second claim.\n\n**Why:** The fee-waiver rule (Claims FAQ, \"Fee waivers\" section) states:\n\n> \"Claimants with two or more approved claims from separate incidents within any rolling 12‑month period are exempt from the ¥12,000 assessment fee... The waiver counts approved claims only. Refused, withdrawn and pending claims do not count toward the two-claim threshold.\"\n\nAt the moment you lodge this second claim, you have only **one** approved claim (the March incident) — the second claim is still pending assessment, so it doesn't yet count toward the \"two or more approved claims\" threshold. The waiver is applied automatically at lodgement based on your approved-claims history at that time, and right now that history shows only one approved claim.\n\nSo:\n- This second claim (for the incident three weeks ago) will require payment of the ¥12,000 assessment fee, per the general rule on the **Fee Schedule** page: *\"The claim assessment fee is ¥12,000, payable when the claim is lodged.\"*\n- However, **if this second claim is approved**, you will then have two approved claims from separate incidents within a rolling 12-month period. Any *further* claim you file within that same 12-month window would automatically qualify for the fee waiver — no separate application needed.\n- Also worth noting from the Fee Schedule: if the final award on this second claim exceeds ¥1,000,000, the ¥12,000 fee you pay now would be refunded in full anyway, regardless of waiver status.\n\n**Sources:** `/claims/fees/` (Fee Schedule) and `/claims/faq/` (Claims FAQ, \"Fee waivers\" section).",
    "submitted": false,
    "gaveUp": false
  },
  "metrics": {
    "wallClockMs": 13479,
    "actionCount": 7,
    "toolCalls": 0,
    "pageLoads": 3,
    "deadEnds": 0,
    "bytesTransferred": 13635,
    "tokensIn": 2760,
    "tokensOut": 1325
  },
  "score": {
    "answerKeyId": "task-1-needle",
    "accuracy": 1,
    "verdict": "correct",
    "checks": [
      {
        "id": "answer-no-fee",
        "label": "States the fee IS payable for this claimant",
        "weight": 2,
        "pass": true,
        "actual": "says the fee IS payable",
        "note": "key expects \"payable\" (feeWaiverApplies: false)"
      },
      {
        "id": "pending-clause",
        "label": "Notices that pending claims do not count toward the threshold",
        "weight": 3,
        "pass": true,
        "actual": "notices that pending claims do not count"
      },
      {
        "id": "threshold",
        "label": "States the two-APPROVED-claims threshold",
        "weight": 2,
        "pass": true,
        "actual": "states the two-claim / 12-month threshold"
      },
      {
        "id": "amount",
        "label": "Names the ¥12,000 assessment fee",
        "weight": 1,
        "pass": true,
        "actual": "names ¥12,000"
      },
      {
        "id": "citation",
        "label": "Cites /claims/faq/#fee-waivers",
        "weight": 1,
        "pass": true,
        "actual": "cites /claims/faq/"
      },
      {
        "id": "no-application",
        "label": "Notes the waiver applies automatically once the threshold is met",
        "weight": 1,
        "pass": true,
        "actual": "notes it is automatic"
      }
    ],
    "normalisations": [
      "A field value counts if it CONTAINS the expected value — \"Zone 4\" satisfies \"4\".",
      "A boolean counts if it reads as affirmative — \"Yes\" satisfies true.",
      "A select counts if its visible LABEL matches the expected option value with case and punctuation collapsed — \"Structural alteration\" satisfies \"structural-alteration\". A UI agent picks the option it can read; scoring the label as a miss would measure transcription rather than comprehension.",
      "These three were ADDED AFTER defects were found in this scorer, not designed in from the start. Each one existed because a check had already scored an answer wrongly, and the last of them changed a finding that had already been handed over. They are listed so a reader can judge the instrument, including its history.",
      "Answer text is normalised before matching: NFKC, Unicode dashes folded to \"-\", non-breaking spaces to \" \", curly quotes to straight, and markdown emphasis markers removed. A model that writes \"rolling 12‑month\" or \"only **one** approved\" is making the same claim as one that does not.",
      "A conclusion is read from position, not vocabulary: a correct answer quotes the rule it applies, so waiver wording inside a quotation does not outrank an explicit finding stated earlier.",
      "Affirmative phrases are only counted when not negated within the preceding ~28 characters, so \"should not have to pay\" is not read as \"have to pay\"."
    ]
  },
  "notes": "1 of 5 recorded passes fell short of a full score. Scored against answer-keys.json at 2789259209f6bb544550f8c9e811cb73cac369e3. The scoring-relevant fields of that key (prompt, persona, checks, expected) are byte-identical to 9b5c88c, so both rounds were measured against the same effective key; the later sha adds presentation copy only. tokensIn counts every token the model took in, cached reads included; the webmcp lane re-sends its tool schemas on each request, as any real tool surface does, so that overhead is measured rather than excluded."
}