{
  "traceVersion": "1.0",
  "runId": "mcp-task-2-eligibility-r2",
  "pass": 2,
  "round": 2,
  "tier": "haiku-4-5",
  "promoted": false,
  "recordedAt": "2026-08-30T04:03:30Z",
  "lane": "webmcp",
  "agent": {
    "name": "drift-race baseline",
    "model": "claude-haiku-4-5-20251001",
    "harness": "drift-race",
    "toolsAvailable": [
      "search_site",
      "get_page_summary",
      "list_services",
      "get_service_requirements",
      "check_eligibility",
      "prefill_permit_form",
      "get_office_info"
    ]
  },
  "site": {
    "baseUrl": "https://office-of-kaiju-affairs.vercel.app",
    "manifestVersion": "1.0",
    "commit": "live"
  },
  "task": {
    "id": "task-2-eligibility",
    "title": "Eligibility determination",
    "prompt": "Using this site, tell me whether I am eligible for damage compensation, what extra support I qualify for, and exactly which documents I need to bring."
  },
  "steps": [
    {
      "index": 1,
      "tMs": 0,
      "durationMs": 2052,
      "type": "think",
      "label": "Chose the next tool to call",
      "outcome": "ok",
      "cost": {
        "tokensIn": 2103,
        "tokensOut": 231
      }
    },
    {
      "index": 2,
      "tMs": 2052,
      "durationMs": 37,
      "type": "tool_call",
      "label": "Called check_eligibility",
      "detail": "7 question(s) to answer",
      "toolCall": {
        "name": "check_eligibility",
        "arguments": {
          "serviceId": "damage-compensation"
        },
        "resultSummary": "7 question(s) to answer",
        "resultBytes": 715,
        "isError": false
      },
      "cost": {
        "bytes": 715
      },
      "outcome": "ok"
    },
    {
      "index": 3,
      "tMs": 2089,
      "durationMs": 1716,
      "type": "think",
      "label": "Chose the next tool to call",
      "outcome": "ok",
      "cost": {
        "tokensIn": 2609,
        "tokensOut": 168
      }
    },
    {
      "index": 4,
      "tMs": 3805,
      "durationMs": 1,
      "type": "tool_call",
      "label": "Called check_eligibility",
      "detail": "eligible, 3 grant(s)",
      "toolCall": {
        "name": "check_eligibility",
        "arguments": {
          "serviceId": "damage-compensation",
          "answers": {
            "zone": "4",
            "structuralDamage": true,
            "incidentsLast12Months": 2,
            "propertyType": "commercial",
            "insurancePayoutReceived": false,
            "householdIncomeYen": 3600000,
            "daysSinceIncident": 21
          }
        },
        "resultSummary": "eligible, 3 grant(s)",
        "resultBytes": 1237,
        "isError": false
      },
      "cost": {
        "bytes": 1237
      },
      "outcome": "ok"
    },
    {
      "index": 5,
      "tMs": 3806,
      "durationMs": 3548,
      "type": "think",
      "label": "Put the answer together",
      "outcome": "ok",
      "cost": {
        "tokensIn": 3496,
        "tokensOut": 447
      }
    },
    {
      "index": 6,
      "tMs": 7354,
      "durationMs": 1200,
      "type": "answer",
      "label": "Gave its answer",
      "detail": "Excellent news! Here's your eligibility status and support: ## **You are ELIGIBLE for damage compensation** ✓ ### **What You Qualify For:** 1. **Assessment Fee Waiver (¥12,000 waived)** - You have 2 approved claims in th",
      "outcome": "ok"
    }
  ],
  "result": {
    "answer": "Excellent news! Here's your eligibility status and support:\n\n## **You are ELIGIBLE for damage compensation** ✓\n\n### **What You Qualify For:**\n\n1. **Assessment Fee Waiver (¥12,000 waived)**\n   - You have 2 approved claims in the last 12 months, which exempts you from the standard ¥12,000 assessment fee.\n   - Source: [Claims FAQ — Fee Waivers](/claims/faq/#fee-waivers)\n\n2. **Hardship Supplement**\n   - Your annual household income of ¥3,600,000 is below the ¥4,000,000 threshold, so you qualify for an additional hardship supplement on top of your base compensation.\n   - Source: [Claims Eligibility](/claims/eligibility/#hardship)\n\n3. **Business Interruption Claim**\n   - As the owner of a commercial property (Tanaka Bakery), you are eligible to claim for business interruption losses caused by the structural damage.\n   - Source: [Damage Compensation Coverage](/claims/damage-compensation/#covered)\n\n### **Documents You Must Bring:**\n\n1. **Incident Report** — documentation of the kaiju incident from 21 days ago\n2. **Damage Survey** — verified assessment of the structural damage to shopfront and rear wall\n3. **Proof of Ownership** — documentation showing you own Tanaka Bakery\n4. **Income Certificate** — proof of your ¥3,600,000 annual household income\n5. **Business Registration** — official registration of your commercial bakery operation\n\nAll of these requirements are based on the published eligibility rules at [Claims Eligibility](/claims/eligibility/).\n\nYou're in a strong position: no insurance payout means you'll receive the full award (not reduced), you've waived the assessment fee due to your recent claims history, and you'll receive the hardship supplement due to your income level.",
    "submitted": false,
    "gaveUp": false
  },
  "metrics": {
    "wallClockMs": 8554,
    "actionCount": 6,
    "toolCalls": 2,
    "pageLoads": 0,
    "deadEnds": 0,
    "bytesTransferred": 136943,
    "tokensIn": 8208,
    "tokensOut": 846
  },
  "score": {
    "answerKeyId": "task-2-eligibility",
    "accuracy": 1,
    "verdict": "correct",
    "checks": [
      {
        "id": "outcome",
        "label": "Concludes eligible",
        "weight": 3,
        "pass": true,
        "actual": "states eligible"
      },
      {
        "id": "fee-waiver",
        "label": "Identifies the assessment-fee waiver",
        "weight": 2,
        "pass": true,
        "actual": "mentions the fee waiver"
      },
      {
        "id": "hardship",
        "label": "Identifies the hardship supplement (income under ¥4,000,000)",
        "weight": 2,
        "pass": true,
        "actual": "mentions the hardship supplement"
      },
      {
        "id": "business-interruption",
        "label": "Identifies business-interruption eligibility",
        "weight": 1,
        "pass": true,
        "actual": "mentions business interruption"
      },
      {
        "id": "documents",
        "label": "Lists all five required documents",
        "weight": 2,
        "pass": true,
        "actual": "5/5 documents named"
      }
    ],
    "normalisations": [
      "A field value counts if it CONTAINS the expected value — \"Zone 4\" satisfies \"4\".",
      "A boolean counts if it reads as affirmative — \"Yes\" satisfies true.",
      "A select counts if its visible LABEL matches the expected option value with case and punctuation collapsed — \"Structural alteration\" satisfies \"structural-alteration\". A UI agent picks the option it can read; scoring the label as a miss would measure transcription rather than comprehension.",
      "These three were ADDED AFTER defects were found in this scorer, not designed in from the start. Each one existed because a check had already scored an answer wrongly, and the last of them changed a finding that had already been handed over. They are listed so a reader can judge the instrument, including its history.",
      "Answer text is normalised before matching: NFKC, Unicode dashes folded to \"-\", non-breaking spaces to \" \", curly quotes to straight, and markdown emphasis markers removed. A model that writes \"rolling 12‑month\" or \"only **one** approved\" is making the same claim as one that does not.",
      "A conclusion is read from position, not vocabulary: a correct answer quotes the rule it applies, so waiver wording inside a quotation does not outrank an explicit finding stated earlier.",
      "Affirmative phrases are only counted when not negated within the preceding ~28 characters, so \"should not have to pay\" is not read as \"have to pay\"."
    ]
  },
  "notes": "0 of 5 recorded passes fell short of a full score. Every pass scored 1.00. Scored against answer-keys.json at 2789259209f6bb544550f8c9e811cb73cac369e3. The scoring-relevant fields of that key (prompt, persona, checks, expected) are byte-identical to 9b5c88c, so both rounds were measured against the same effective key; the later sha adds presentation copy only. tokensIn counts every token the model took in, cached reads included; the webmcp lane re-sends its tool schemas on each request, as any real tool surface does, so that overhead is measured rather than excluded."
}